{
  "$schema": "https://artemsemdev.github.io/SeaRise-Europe/contracts/candidate-completeness/v2/candidate.schema.json",
  "schemaVersion": "2.0.0",
  "contractId": "phase-1-pre-sign-candidate-completeness-v2",
  "candidateId": "candidate-phase-1-fixture-20260811-0123456789ab",
  "dataReleaseId": "searise-europe-v1.0.0-20260811-0123456789ab",
  "dataProvenanceClass": "synthetic-fixture",
  "publicationClaim": false,
  "geometryPolicy": {
    "status": "unapproved-product-scope-approximation",
    "purpose": "product-eligibility-only",
    "ownerApprovalRecorded": false,
    "canonical": false,
    "production": false,
    "publicationEligible": false,
    "hazardExtentClaim": false
  },
  "artifacts": [
    {"artifactId":"scenario-config","path":"config/scenarios.json","role":"scenario-config","mediaType":"application/json","contentEncoding":"identity","dataReleaseId":"searise-europe-v1.0.0-20260811-0123456789ab","dataProvenanceClass":"synthetic-fixture","immutable":true,"byteSize":1,"sha256":"aaaaaaaaaaaaaaaaaaaaaaaaaaaaaaaaaaaaaaaaaaaaaaaaaaaaaaaaaaaaaaaa","writeSequence":1,"rights":{"attributionIds":["searise-europe-candidate-completeness-v1"],"redistribution":"allowed"}},
    {"artifactId":"methodology","path":"config/methodology.json","role":"methodology","mediaType":"application/json","contentEncoding":"identity","dataReleaseId":"searise-europe-v1.0.0-20260811-0123456789ab","dataProvenanceClass":"synthetic-fixture","immutable":true,"byteSize":1,"sha256":"aaaaaaaaaaaaaaaaaaaaaaaaaaaaaaaaaaaaaaaaaaaaaaaaaaaaaaaaaaaaaaaa","writeSequence":2,"rights":{"attributionIds":["searise-europe-candidate-completeness-v1"],"redistribution":"allowed"}},
    {"artifactId":"source-attribution","path":"config/source-attribution.json","role":"source-attribution","mediaType":"application/json","contentEncoding":"identity","dataReleaseId":"searise-europe-v1.0.0-20260811-0123456789ab","dataProvenanceClass":"synthetic-fixture","immutable":true,"byteSize":1,"sha256":"aaaaaaaaaaaaaaaaaaaaaaaaaaaaaaaaaaaaaaaaaaaaaaaaaaaaaaaaaaaaaaaa","writeSequence":3,"rights":{"attributionIds":["searise-europe-candidate-completeness-v1"],"redistribution":"allowed"}},
    {"artifactId":"source-receipt","path":"receipts/sources/ipcc-ar6.json","role":"source-receipt","mediaType":"application/json","contentEncoding":"identity","dataReleaseId":"searise-europe-v1.0.0-20260811-0123456789ab","dataProvenanceClass":"synthetic-fixture","immutable":true,"byteSize":1,"sha256":"aaaaaaaaaaaaaaaaaaaaaaaaaaaaaaaaaaaaaaaaaaaaaaaaaaaaaaaaaaaaaaaa","writeSequence":4,"rights":{"attributionIds":["ipcc-ar6-sl-projections-20210809"],"redistribution":"allowed"}},
    {"artifactId":"source-receipt-geonames-admin1-codes-ascii","path":"receipts/sources/geonames-admin1-codes-ascii.json","role":"source-receipt","mediaType":"application/json","contentEncoding":"identity","dataReleaseId":"searise-europe-v1.0.0-20260811-0123456789ab","dataProvenanceClass":"synthetic-fixture","immutable":true,"byteSize":1,"sha256":"aaaaaaaaaaaaaaaaaaaaaaaaaaaaaaaaaaaaaaaaaaaaaaaaaaaaaaaaaaaaaaaa","writeSequence":5,"rights":{"attributionIds":["geonames-admin1-codes-ascii-2026-08-10"],"redistribution":"allowed"}},
    {"artifactId":"source-receipt-geonames-all-countries","path":"receipts/sources/geonames-all-countries.json","role":"source-receipt","mediaType":"application/json","contentEncoding":"identity","dataReleaseId":"searise-europe-v1.0.0-20260811-0123456789ab","dataProvenanceClass":"synthetic-fixture","immutable":true,"byteSize":1,"sha256":"aaaaaaaaaaaaaaaaaaaaaaaaaaaaaaaaaaaaaaaaaaaaaaaaaaaaaaaaaaaaaaaa","writeSequence":6,"rights":{"attributionIds":["geonames-all-countries-2026-08-10"],"redistribution":"allowed"}},
    {"artifactId":"source-receipt-geonames-alternate-names-v2","path":"receipts/sources/geonames-alternate-names-v2.json","role":"source-receipt","mediaType":"application/json","contentEncoding":"identity","dataReleaseId":"searise-europe-v1.0.0-20260811-0123456789ab","dataProvenanceClass":"synthetic-fixture","immutable":true,"byteSize":1,"sha256":"aaaaaaaaaaaaaaaaaaaaaaaaaaaaaaaaaaaaaaaaaaaaaaaaaaaaaaaaaaaaaaaa","writeSequence":7,"rights":{"attributionIds":["geonames-alternate-names-v2-2026-08-10"],"redistribution":"allowed"}},
    {"artifactId":"source-receipt-geonames-format-readme","path":"receipts/sources/geonames-format-readme.json","role":"source-receipt","mediaType":"application/json","contentEncoding":"identity","dataReleaseId":"searise-europe-v1.0.0-20260811-0123456789ab","dataProvenanceClass":"synthetic-fixture","immutable":true,"byteSize":1,"sha256":"aaaaaaaaaaaaaaaaaaaaaaaaaaaaaaaaaaaaaaaaaaaaaaaaaaaaaaaaaaaaaaaa","writeSequence":8,"rights":{"attributionIds":["geonames-format-readme-2026-08-10"],"redistribution":"allowed"}},
    {"artifactId":"source-receipt-natural-earth-admin0","path":"receipts/sources/natural-earth-10m-admin0.json","role":"source-receipt","mediaType":"application/json","contentEncoding":"identity","dataReleaseId":"searise-europe-v1.0.0-20260811-0123456789ab","dataProvenanceClass":"synthetic-fixture","immutable":true,"byteSize":1,"sha256":"aaaaaaaaaaaaaaaaaaaaaaaaaaaaaaaaaaaaaaaaaaaaaaaaaaaaaaaaaaaaaaaa","writeSequence":9,"rights":{"attributionIds":["natural-earth-10m-admin0-5.1.1"],"redistribution":"allowed"}},
    {"artifactId":"source-receipt-natural-earth-ocean","path":"receipts/sources/natural-earth-10m-ocean.json","role":"source-receipt","mediaType":"application/json","contentEncoding":"identity","dataReleaseId":"searise-europe-v1.0.0-20260811-0123456789ab","dataProvenanceClass":"synthetic-fixture","immutable":true,"byteSize":1,"sha256":"aaaaaaaaaaaaaaaaaaaaaaaaaaaaaaaaaaaaaaaaaaaaaaaaaaaaaaaaaaaaaaaa","writeSequence":10,"rights":{"attributionIds":["natural-earth-10m-ocean-5.1.1"],"redistribution":"allowed"}},
    {"artifactId":"build-receipt","path":"receipts/build.json","role":"build-receipt","mediaType":"application/json","contentEncoding":"identity","dataReleaseId":"searise-europe-v1.0.0-20260811-0123456789ab","dataProvenanceClass":"synthetic-fixture","immutable":true,"byteSize":1,"sha256":"aaaaaaaaaaaaaaaaaaaaaaaaaaaaaaaaaaaaaaaaaaaaaaaaaaaaaaaaaaaaaaaa","writeSequence":11,"rights":{"attributionIds":["searise-europe-candidate-completeness-v1"],"redistribution":"allowed"}},
    {"artifactId":"projection-matrix-geoparquet","path":"analysis/projections.parquet","role":"projection-geoparquet","mediaType":"application/vnd.apache.parquet","contentEncoding":"identity","dataReleaseId":"searise-europe-v1.0.0-20260811-0123456789ab","dataProvenanceClass":"synthetic-fixture","immutable":true,"byteSize":1,"sha256":"aaaaaaaaaaaaaaaaaaaaaaaaaaaaaaaaaaaaaaaaaaaaaaaaaaaaaaaaaaaaaaaa","writeSequence":12,"rights":{"attributionIds":["ipcc-ar6-sl-projections-20210809"],"redistribution":"allowed"}},
    {"artifactId":"support-boundary-geoparquet","path":"boundaries/europe.parquet","role":"support-boundary","mediaType":"application/vnd.apache.parquet","contentEncoding":"identity","dataReleaseId":"searise-europe-v1.0.0-20260811-0123456789ab","dataProvenanceClass":"synthetic-fixture","immutable":true,"byteSize":1,"sha256":"aaaaaaaaaaaaaaaaaaaaaaaaaaaaaaaaaaaaaaaaaaaaaaaaaaaaaaaaaaaaaaaa","writeSequence":13,"rights":{"attributionIds":["natural-earth-10m-admin0-5.1.1"],"redistribution":"allowed"}},
    {"artifactId":"support-boundary-pmtiles","path":"boundaries/europe.pmtiles","role":"support-boundary","mediaType":"application/vnd.pmtiles","contentEncoding":"identity","dataReleaseId":"searise-europe-v1.0.0-20260811-0123456789ab","dataProvenanceClass":"synthetic-fixture","immutable":true,"byteSize":1,"sha256":"aaaaaaaaaaaaaaaaaaaaaaaaaaaaaaaaaaaaaaaaaaaaaaaaaaaaaaaaaaaaaaaa","writeSequence":14,"rights":{"attributionIds":["natural-earth-10m-admin0-5.1.1"],"redistribution":"allowed"}},
    {"artifactId":"coastal-boundary-geoparquet","path":"boundaries/coastal-analysis-zone.parquet","role":"coastal-boundary","mediaType":"application/vnd.apache.parquet","contentEncoding":"identity","dataReleaseId":"searise-europe-v1.0.0-20260811-0123456789ab","dataProvenanceClass":"synthetic-fixture","immutable":true,"byteSize":1,"sha256":"aaaaaaaaaaaaaaaaaaaaaaaaaaaaaaaaaaaaaaaaaaaaaaaaaaaaaaaaaaaaaaaa","writeSequence":15,"rights":{"attributionIds":["natural-earth-10m-ocean-5.1.1"],"redistribution":"allowed"}},
    {"artifactId":"coastal-boundary-pmtiles","path":"boundaries/coastal-analysis-zone.pmtiles","role":"coastal-boundary","mediaType":"application/vnd.pmtiles","contentEncoding":"identity","dataReleaseId":"searise-europe-v1.0.0-20260811-0123456789ab","dataProvenanceClass":"synthetic-fixture","immutable":true,"byteSize":1,"sha256":"aaaaaaaaaaaaaaaaaaaaaaaaaaaaaaaaaaaaaaaaaaaaaaaaaaaaaaaaaaaaaaaa","writeSequence":16,"rights":{"attributionIds":["natural-earth-10m-ocean-5.1.1"],"redistribution":"allowed"}},
    {"artifactId":"settlements-geoparquet","path":"search/settlements.parquet","role":"settlement-geoparquet","mediaType":"application/vnd.apache.parquet","contentEncoding":"identity","dataReleaseId":"searise-europe-v1.0.0-20260811-0123456789ab","dataProvenanceClass":"synthetic-fixture","immutable":true,"byteSize":1,"sha256":"aaaaaaaaaaaaaaaaaaaaaaaaaaaaaaaaaaaaaaaaaaaaaaaaaaaaaaaaaaaaaaaa","writeSequence":17,"rights":{"attributionIds":["geonames-admin1-codes-ascii-2026-08-10","geonames-all-countries-2026-08-10","geonames-alternate-names-v2-2026-08-10","geonames-format-readme-2026-08-10"],"redistribution":"allowed"}},